{
  "schemaVersion": "1.0.0",
  "snapshotId": "22222222-2222-4222-8222-222222222222",
  "items": [
    {
      "evidenceId": "ev_author_available",
      "type": "AUTHOR_AVAILABILITY",
      "visibility": "PUBLIC_GLOBAL",
      "subjectGithubNodeId": "U_fixture_established",
      "providerNodeId": "PR_target_42",
      "repositoryNodeId": "R_fixture_target",
      "eventAt": "2026-07-20T23:59:00Z",
      "observedAt": "2026-07-21T00:00:00Z",
      "collectorVersion": "github-graphql-v1",
      "collectionRunId": "33333333-3333-4333-8333-333333333333",
      "canonicalPayload": {
        "pullRequestNodeId": "PR_target_42",
        "repositoryNodeId": "R_fixture_target",
        "pullRequestNumber": 42,
        "available": true,
        "authorNodeId": "U_fixture_established"
      },
      "sourceUrl": "https://github.com/example/target/pull/42",
      "providerLocator": {
        "kind": "repository",
        "nodeId": "R_fixture_target",
        "nameWithOwner": "example/target"
      }
    },
    {
      "evidenceId": "ev_actor_type",
      "type": "ACTOR_TYPE",
      "visibility": "PUBLIC_GLOBAL",
      "subjectGithubNodeId": "U_fixture_established",
      "providerNodeId": "U_fixture_established",
      "repositoryNodeId": "R_fixture_target",
      "observedAt": "2026-07-21T00:00:00Z",
      "collectorVersion": "github-graphql-v1",
      "collectionRunId": "33333333-3333-4333-8333-333333333333",
      "canonicalPayload": {
        "pullRequestNodeId": "PR_target_42",
        "repositoryNodeId": "R_fixture_target",
        "pullRequestNumber": 42,
        "actorNodeId": "U_fixture_established",
        "actorType": "User"
      },
      "sourceUrl": "https://github.com/example/target/pull/42",
      "providerLocator": {
        "kind": "repository",
        "nodeId": "R_fixture_target",
        "nameWithOwner": "example/target"
      }
    },
    {
      "evidenceId": "ev_account",
      "type": "ACCOUNT_CREATED",
      "visibility": "PUBLIC_GLOBAL",
      "subjectGithubNodeId": "U_fixture_established",
      "providerNodeId": "U_fixture_established",
      "eventAt": "2019-12-01T00:00:00Z",
      "observedAt": "2026-07-21T00:00:00Z",
      "collectorVersion": "github-graphql-v1",
      "collectionRunId": "33333333-3333-4333-8333-333333333333",
      "canonicalPayload": {
        "createdAt": "2019-12-01T00:00:00Z"
      },
      "sourceUrl": "https://github.com/established-contributor",
      "providerLocator": {
        "kind": "actor",
        "nodeId": "U_fixture_established",
        "login": "established-contributor"
      }
    },
    {
      "evidenceId": "ev_year",
      "type": "CONTRIBUTION_YEAR",
      "visibility": "PUBLIC_GLOBAL",
      "subjectGithubNodeId": "U_fixture_established",
      "observedAt": "2026-07-21T00:00:00Z",
      "collectorVersion": "github-graphql-v1",
      "collectionRunId": "33333333-3333-4333-8333-333333333333",
      "canonicalPayload": {
        "year": 2022,
        "activeMonths": [
          "2022-06"
        ]
      },
      "sourceUrl": "https://github.com/established-contributor",
      "providerLocator": {
        "kind": "actor",
        "nodeId": "U_fixture_established",
        "login": "established-contributor"
      }
    },
    {
      "evidenceId": "ev_year_mid",
      "type": "CONTRIBUTION_YEAR",
      "visibility": "PUBLIC_GLOBAL",
      "subjectGithubNodeId": "U_fixture_established",
      "observedAt": "2026-07-21T00:00:00Z",
      "collectorVersion": "github-graphql-v1",
      "collectionRunId": "33333333-3333-4333-8333-333333333333",
      "canonicalPayload": {
        "year": 2025,
        "activeMonths": [
          "2025-11"
        ]
      },
      "sourceUrl": "https://github.com/established-contributor",
      "providerLocator": {
        "kind": "actor",
        "nodeId": "U_fixture_established",
        "login": "established-contributor"
      }
    },
    {
      "evidenceId": "ev_year_recent",
      "type": "CONTRIBUTION_YEAR",
      "visibility": "PUBLIC_GLOBAL",
      "subjectGithubNodeId": "U_fixture_established",
      "observedAt": "2026-07-21T00:00:00Z",
      "collectorVersion": "github-graphql-v1",
      "collectionRunId": "33333333-3333-4333-8333-333333333333",
      "canonicalPayload": {
        "year": 2026,
        "activeMonths": [
          "2026-06"
        ]
      },
      "sourceUrl": "https://github.com/established-contributor",
      "providerLocator": {
        "kind": "actor",
        "nodeId": "U_fixture_established",
        "login": "established-contributor"
      }
    },
    {
      "evidenceId": "ev_active_old",
      "type": "ACTIVE_MONTH",
      "visibility": "PUBLIC_DERIVED",
      "subjectGithubNodeId": "U_fixture_established",
      "eventAt": "2022-06-01T00:00:00Z",
      "observedAt": "2026-07-21T00:00:00Z",
      "collectorVersion": "evidence-derivation-v1",
      "collectionRunId": "33333333-3333-4333-8333-333333333333",
      "canonicalPayload": {
        "yearMonth": "2022-06"
      },
      "derivation": {
        "version": "active-month-v1",
        "inputEvidenceIds": [
          "ev_year"
        ]
      }
    },
    {
      "evidenceId": "ev_active_mid",
      "type": "ACTIVE_MONTH",
      "visibility": "PUBLIC_DERIVED",
      "subjectGithubNodeId": "U_fixture_established",
      "eventAt": "2025-11-01T00:00:00Z",
      "observedAt": "2026-07-21T00:00:00Z",
      "collectorVersion": "evidence-derivation-v1",
      "collectionRunId": "33333333-3333-4333-8333-333333333333",
      "canonicalPayload": {
        "yearMonth": "2025-11"
      },
      "derivation": {
        "version": "active-month-v1",
        "inputEvidenceIds": [
          "ev_year_mid"
        ]
      }
    },
    {
      "evidenceId": "ev_active",
      "type": "ACTIVE_MONTH",
      "visibility": "PUBLIC_DERIVED",
      "subjectGithubNodeId": "U_fixture_established",
      "eventAt": "2026-06-01T00:00:00Z",
      "observedAt": "2026-07-21T00:00:00Z",
      "collectorVersion": "evidence-derivation-v1",
      "collectionRunId": "33333333-3333-4333-8333-333333333333",
      "canonicalPayload": {
        "yearMonth": "2026-06"
      },
      "derivation": {
        "version": "active-month-v1",
        "inputEvidenceIds": [
          "ev_year_recent"
        ]
      }
    },
    {
      "evidenceId": "ev_pr_opened",
      "type": "PULL_REQUEST_OPENED",
      "visibility": "PUBLIC_GLOBAL",
      "subjectGithubNodeId": "U_fixture_established",
      "providerNodeId": "PR_public_12",
      "repositoryNodeId": "R_public_project",
      "eventAt": "2026-05-01T00:00:00Z",
      "observedAt": "2026-07-21T00:00:00Z",
      "collectorVersion": "github-graphql-v1",
      "collectionRunId": "33333333-3333-4333-8333-333333333333",
      "canonicalPayload": {
        "pullRequestNodeId": "PR_public_12",
        "repositoryNodeId": "R_public_project",
        "repositoryOwnerNodeId": "O_example_project",
        "authorNodeId": "U_fixture_established",
        "authorAssociation": "CONTRIBUTOR",
        "pullRequestNumber": 12,
        "metadataStructureFingerprint": "17482678565903f2d45ab9f063ec02da227702590241b95044cf406e209dee19",
        "metadataFeatureVersion": "pr-metadata-structure-v1",
        "openedAt": "2026-05-01T00:00:00Z",
        "metadataStructure": {
          "titleTokenClasses": [
            "word",
            "word",
            "code"
          ],
          "bodySectionKinds": [
            "summary",
            "changes",
            "testing"
          ],
          "referenceKinds": [
            "issue"
          ]
        },
        "repositoryTemplateStructure": null,
        "templateAdjustedStructure": {
          "titleTokenClasses": [
            "word",
            "word",
            "code"
          ],
          "bodySectionKinds": [
            "summary",
            "changes",
            "testing"
          ],
          "referenceKinds": [
            "issue"
          ]
        },
        "templateAdjustedFingerprint": "17482678565903f2d45ab9f063ec02da227702590241b95044cf406e209dee19",
        "informativeFeatureCount": 7
      },
      "sourceUrl": "https://github.com/example/project/pull/12",
      "providerLocator": {
        "kind": "repository",
        "nodeId": "R_public_project",
        "nameWithOwner": "example/project"
      }
    },
    {
      "evidenceId": "ev_pr",
      "type": "PULL_REQUEST_MERGED",
      "visibility": "PUBLIC_GLOBAL",
      "subjectGithubNodeId": "U_fixture_established",
      "providerNodeId": "PR_public_12",
      "repositoryNodeId": "R_public_project",
      "eventAt": "2026-05-04T00:00:00Z",
      "observedAt": "2026-07-21T00:00:00Z",
      "collectorVersion": "github-graphql-v1",
      "collectionRunId": "33333333-3333-4333-8333-333333333333",
      "canonicalPayload": {
        "pullRequestNodeId": "PR_public_12",
        "repositoryNodeId": "R_public_project",
        "authorNodeId": "U_fixture_established",
        "pullRequestNumber": 12,
        "mergedAt": "2026-05-04T00:00:00Z",
        "mergeCommitSha": "eeeeeeeeeeeeeeeeeeeeeeeeeeeeeeeeeeeeeeee"
      },
      "sourceUrl": "https://github.com/example/project/pull/12",
      "providerLocator": {
        "kind": "repository",
        "nodeId": "R_public_project",
        "nameWithOwner": "example/project"
      }
    },
    {
      "evidenceId": "ev_merge_actor",
      "type": "MERGE_ACTOR",
      "visibility": "PUBLIC_GLOBAL",
      "subjectGithubNodeId": "U_fixture_established",
      "providerNodeId": "U_independent_maintainer",
      "repositoryNodeId": "R_public_project",
      "eventAt": "2026-05-04T00:00:00Z",
      "observedAt": "2026-07-21T00:00:00Z",
      "collectorVersion": "github-graphql-v1",
      "collectionRunId": "33333333-3333-4333-8333-333333333333",
      "canonicalPayload": {
        "pullRequestNodeId": "PR_public_12",
        "repositoryNodeId": "R_public_project",
        "pullRequestNumber": 12,
        "pullRequestAuthorNodeId": "U_fixture_established",